{
  "guid": "d071bf32-44c5-47a6-a072-a0273e3f9b2a",
  "name": "plans-process-cards-pain-32",
  "type": "issue",
  "actualStart": "2026-09-03",
  "isPartOf": "65005a4b-abf0-4f4c-ab97-b8657c34b854",
  "representedBy": "../../../artifacts/pain-log/pain-log.md",
  "body": "Execution pass ran on thumb 1 alone.",
  "sourceVerified": false
}
