{
  "guid": "7368c88b-4350-4d42-841d-49a8efc58e50",
  "name": "reports-outside-01-license",
  "type": "issue",
  "actualStart": "2026-09-03",
  "state": "done",
  "isPartOf": "4bfb6de0-6c5b-4942-8408-514e2cd18a36",
  "representedBy": "../../../../artifacts/outside-01/review.md",
  "body": "MIT on all four repos. Compatible with Godot; keeps attribution; leaves the door open for organisation-specific renderer forks. Where NASA material appears, an attribution note names the source.",
  "sourceVerified": false
}
