{
  "guid": "29eff053-5d17-4abd-afac-af2c93a8f9b8",
  "name": "reports-outside-02-state-optional",
  "type": "issue",
  "actualStart": "2026-09-03",
  "state": "open",
  "isPartOf": "d7b05018-421f-4d2d-aaa6-688156b489b2",
  "representedBy": "../../../../artifacts/outside-02/review.md",
  "body": "state is not required on any type. Optional status, in a status tool. The performed np convention is in VALIDATE.md. Relates to plans/warp-v1.",
  "sourceVerified": false
}
