{
  "guid": "eaf9f00e-2d36-4e06-9a16-6e67def732cb",
  "name": "plans-render-turn-one-pain-33",
  "type": "issue",
  "actualStart": "2026-09-03",
  "isPartOf": "c246f99f-9346-4f36-bff9-3c9029f1d02e",
  "representedBy": "../../../artifacts/pain-log/pain-log.md",
  "body": "A tool limit was stated after it cost the sitting, not up front.",
  "sourceVerified": false
}
