{
  "guid": "7eae0107-12b1-448f-8ba4-ff9b623287f7",
  "name": "plans-warp-v1-pain-30",
  "type": "issue",
  "actualStart": "2026-09-02",
  "isPartOf": "706d91f0-f219-4687-89a3-75e0de5a6343",
  "representedBy": "../../../artifacts/pain-log/pain-log.md",
  "body": "The walk packet on disk was treated as unread.",
  "sourceVerified": false
}
