{
  "guid": "91a9f5ea-d18d-43b5-a4f0-1802ed0c251c",
  "name": "reports-outside-01-godot-vs-web",
  "type": "issue",
  "actualStart": "2026-09-03",
  "state": "open",
  "isPartOf": "4bfb6de0-6c5b-4942-8408-514e2cd18a36",
  "representedBy": "../../../../artifacts/outside-01/review.md",
  "body": "First weave is Godot. The outside pass says the useful view is a read-only web page and that the cinematic bet eats it. Relates to plans/weave and plans/render-turn-one.",
  "sourceVerified": false
}
